[
  {
    "name": "spine1",
    "platform": "frr",
    "asn": 4200000001,
    "router_id": "10.0.0.1",
    "peers": [
      { "ip": "10.10.1.2", "asn": 4200000003, "description": "leaf1" },
      { "ip": "10.10.2.2", "asn": 4200000004, "description": "leaf2" }
    ]
  },
  {
    "name": "leaf1",
    "platform": "arista_eos",
    "asn": 4200000003,
    "router_id": "10.0.0.3",
    "peers": [
      { "ip": "10.10.1.1", "asn": 4200000001, "description": "spine1" },
      { "ip": "10.10.3.1", "asn": 4200000002, "description": "spine2" }
    ]
  },
  {
    "name": "leaf2",
    "platform": "frr",
    "asn": 4200000004,
    "router_id": "10.0.0.4",
    "peers": [
      { "ip": "10.10.2.1", "asn": 4200000001, "description": "spine1" },
      { "ip": "10.10.4.1", "asn": 4200000002, "description": "spine2" }
    ]
  }
]
